{
  "sprint_id": "SPR-000001",
  "schema_type": "sprint-object",
  "schema_version": "v1",
  "address": "/example/internal_general/governance/innovation_os/sprint/artifact/ART-spr-000001/v1",
  "address_struct": {
    "environment": "example",
    "authority_zone": "internal_general",
    "layer": "governance",
    "domain": "innovation_os",
    "module": "sprint",
    "object_type": "artifact",
    "object_id": "ART-spr-000001",
    "version": "v1"
  },
  "title": "Reduce carrier portal rejections",
  "status": "planned",
  "source_refs": {
    "opportunity_ids": [
      "OPP-000001"
    ],
    "pressure_vector_ids": [
      "PV-000101"
    ]
  },
  "ownership": {
    "primary_owner": "innovation_product_lead",
    "ops_owner": "billing_ops_owner",
    "review_required": true,
    "executive_sponsor": "cino_delegate"
  },
  "delivery_scope": {
    "scope_summary": "Carrier-scoped workflow remediation",
    "timebox": "14 days",
    "exception_handling_path": "human queue after policy checks"
  },
  "success_hypothesis": "Reducing recurring portal rejection paths will shorten work-to-cash cycle time and reduce manual billing labor.",
  "success_metrics": [
    "rejection rate",
    "manual touch time",
    "cycle time"
  ],
  "guardrails": [
    "no direct canonical mutation",
    "requires validation gate before scale"
  ],
  "mutation_boundary": {
    "no_direct_canonical_mutation": true,
    "promotion_decision_required_for_canonical_change": true,
    "validation_gate_required_before_scale": true
  },
  "notes": "This example shows a bounded execution sprint that stays inside the operating layer until it earns gate review."
}
